{
  "id": "misteri-gunung-merapi",
  "title": "misteri gunung merapi",
  "description": "melacak cerita turun temurun dan dampak terhadap budaya",
  "aspect_ratio": "9:16",
  "resolution": {
    "width": 1080,
    "height": 1920
  },
  "fps": 30,
  "created_at": "2026-10-24T03:06:09.212357+00:00",
  "updated_at": "2026-10-24T03:06:09.212357+00:00",
  "settings": {
    "voice": "id-ID-ArdiNeural",
    "bgm_volume": 0.15,
    "ducking_volume": 0.04,
    "motion_graphics_style": "documentary_modern"
  },
  "storyboard": {
    "version": "1.0.0",
    "total_estimated_duration_sec": 4.0,
    "scenes": [
      {
        "scene_id": "scene-1",
        "scene_number": 1,
        "title": "Pembuka / Hook",
        "narration_text": "Dalam rekaman sejarah ini, kita menyaksikan awal mula misteri gunung merapi.",
        "shots": [
          {
            "shot_id": "shot-1",
            "shot_type": "wide_angle",
            "camera_movement": "slow_push_in",
            "visual_prompt": "Cinematic wide shot establishing misteri gunung merapi, highly detailed documentary atmosphere",
            "flow_parameters": {
              "lighting": "cinematic dramatic lighting",
              "lens": "35mm anamorphic",
              "aspect_ratio": "9:16",
              "negative_prompt": "low quality, cartoon, blurry, distorted"
            },
            "duration_sec": 4.0,
            "motion_graphic": {
              "type": "none",
              "headline": null,
              "subtext": null
            },
            "asset_path": null
          }
        ]
      }
    ]
  }
}