{
  "id": "misteri-peradaban-nusantara",
  "title": "Misteri Peradaban Maritim Nusantara",
  "description": "Dokumenter sejarah mengenai kejayaan navigasi bahari dan rahasia kapal pinisi mengarungi samudera purba.",
  "aspect_ratio": "9:16",
  "resolution": {
    "width": 1080,
    "height": 1920
  },
  "fps": 30,
  "created_at": "2026-10-24T10:00:00Z",
  "updated_at": "2026-10-24T10:00:00Z",
  "settings": {
    "voice": "id-ID-ArdiNeural",
    "bgm_volume": 0.15,
    "ducking_volume": 0.04,
    "motion_graphics_style": "documentary_modern"
  },
  "storyboard": {
    "version": "1.0.0",
    "total_estimated_duration_sec": 12.0,
    "scenes": [
      {
        "scene_id": "scene-1",
        "scene_number": 1,
        "title": "Hook: Rahasia Samudera Purba",
        "narration_text": "Jauh sebelum peta modern digambar, pelaut Nusantara telah menaklukkan luasnya samudera tanpa kompas magnetik.",
        "shots": [
          {
            "shot_id": "shot-101",
            "shot_type": "drone_aerial",
            "camera_movement": "slow_push_in",
            "visual_prompt": "Cinematic aerial top-down view of turquoise ocean with deep ocean trenches and ancient wooden ship breaking gentle waves",
            "flow_parameters": {
              "lighting": "golden hour dramatic lighting with sun flares",
              "lens": "24mm anamorphic wide",
              "aspect_ratio": "9:16",
              "negative_prompt": "modern boat, motor, blurry, plastic"
            },
            "duration_sec": 4.0,
            "motion_graphic": {
              "type": "titlecard",
              "headline": "MISTERI SAMUDERA PURBA",
              "subtext": "Dokumenter Sejarah Nusantara"
            },
            "asset_path": null
          }
        ]
      },
      {
        "scene_id": "scene-2",
        "scene_number": 2,
        "title": "Anatomi Kapal Pinisi",
        "narration_text": "Dibuat dari kayu ulin pilihan, pasak kayu menjadi rahasia kekuatan kapal legendaris ini.",
        "shots": [
          {
            "shot_id": "shot-102",
            "shot_type": "macro_detail",
            "camera_movement": "slow_push_in",
            "visual_prompt": "Extreme macro close-up of master craftsman hands fitting ancient ironwood dowel into a traditional wooden ship hull, dust particles glowing in golden sunlight",
            "flow_parameters": {
              "lighting": "volumetric sunbeams filtering into traditional shipyard",
              "lens": "85mm macro f/1.4",
              "aspect_ratio": "9:16",
              "negative_prompt": "modern power tools, blurry, cartoon"
            },
            "duration_sec": 4.0,
            "motion_graphic": {
              "type": "lower_third",
              "headline": "Pasak Kayu Ulin",
              "subtext": "Konstruksi tanpa paku logam modern"
            },
            "asset_path": null
          },
          {
            "shot_id": "shot-103",
            "shot_type": "medium_shot",
            "camera_movement": "tracking_shot",
            "visual_prompt": "Full sail traditional Pinisi ship cutting through open deep blue waves, camera tracking closely along the ship hull",
            "flow_parameters": {
              "lighting": "cinematic moody sunset with deep orange and teal contrast",
              "lens": "35mm anamorphic",
              "aspect_ratio": "9:16",
              "negative_prompt": "digital artifacts, low quality, cartoon"
            },
            "duration_sec": 4.0,
            "motion_graphic": {
              "type": "none",
              "headline": null,
              "subtext": null
            },
            "asset_path": null
          }
        ]
      }
    ]
  }
}
